id,title,year,journal_name,conf_name
67037095,End-To-End Memory Networks,2015,arXiv: Neural and Evolutionary Computing,
172488144,Learning with hidden variables,2015,arXiv: Neurons and Cognition,
382934598,QCD-Aware Recursive Neural Networks for Jet Physics,2017,arXiv: High Energy Physics - Phenomenology,
453919658,Using Sentence-Level LSTM Language Models for Script Inference,2016,arXiv: Computation and Language,
472554184,Delta Networks for Optimized Recurrent Network Computation,2016,arXiv: Neural and Evolutionary Computing,
137917867,Recurrent Fully Convolutional Neural Networks for Multi-slice MRI Cardiac Segmentation,2016,arXiv: Machine Learning,
356185344,Neural Word Segmentation Learning for Chinese,2016,arXiv: Computation and Language,
405668894,Toward an Integration of Deep Learning and Neuroscience,2016,Frontiers in Computational Neuroscience,
89079069,Adversarial TableQA: Attention Supervision for Question Answering on Tables.,2018,arXiv: Computation and Language,
52117712,Learning to Communicate with Deep Multi-Agent Reinforcement Learning,2016,arXiv: Artificial Intelligence,
475398637,GraphRNN: Generating Realistic Graphs with Deep Auto-regressive Models,2018,arXiv: Learning,
204552391,Towards Bidirectional Hierarchical Representations for Attention-Based Neural Machine Translation,2017,arXiv: Computation and Language,
88094222,Dynamical Isometry and a Mean Field Theory of RNNs: Gating Enables Signal Propagation in Recurrent Neural Networks,2018,arXiv: Machine Learning,
172334398,Automatically Composing Representation Transformations as a Means for Generalization.,2018,arXiv: Learning,
429618757,Towards Machine Comprehension of Spoken Content: Initial TOEFL Listening Comprehension Test by Machine,2016,arXiv: Computation and Language,
432525642,Time Series Deinterleaving of DNS Traffic,2018,arXiv: Learning,
143460923,Conversational Response Re-ranking Based on Event Causality and Role Factored Tensor Event Embedding,2019,arXiv: Computation and Language,
306939934,Improving Interpretability of Deep Neural Networks with Semantic Information,2017,arXiv: Computer Vision and Pattern Recognition,
131472610,Understanding Hidden Memories of Recurrent Neural Networks,2017,arXiv: Computation and Language,
301155515,Where-and-When to Look: Deep Siamese Attention Networks for Video-based Person Re-identification.,2018,arXiv: Computer Vision and Pattern Recognition,
116132675,Snore-GANs: Improving Automatic Snore Sound Classification with Synthesized Data,2019,arXiv: Learning,
455063379,Improving Background Based Conversation with Context-aware Knowledge Pre-selection.,2019,arXiv: Computation and Language,
272876665,Structured Inference Networks for Nonlinear State Space Models,2016,arXiv: Machine Learning,
81937843,Modeling Melodic Feature Dependency with Modularized Variational Auto-Encoder,2018,arXiv: Artificial Intelligence,
15213162,Using Recurrent Neural Networks to Build a Stopping Algorithm for an Adaptive Assessment,2019,,
418044869,Balanced Quantization: An Effective and Efficient Approach to Quantized Neural Networks,2017,arXiv: Computer Vision and Pattern Recognition,
307166363,Adversarial Decomposition of Text Representation.,2018,arXiv: Computation and Language,
337355410,A Gentle Introduction to Deep Learning in Medical Image Processing,2018,arXiv: Computer Vision and Pattern Recognition,
24806143,Addressee and Response Selection in Multi-Party Conversations with Speaker Interaction RNNs,2017,arXiv: Computation and Language,
449873515,Self-Attention Linguistic-Acoustic Decoder.,2018,arXiv: Sound,
172394064,Skip RNN: Learning to Skip State Updates in Recurrent Neural Networks,2017,arXiv: Artificial Intelligence,
24001716,A deep recurrent neural network discovers complex biological rules to decipher RNA protein-coding potential,2018,Nucleic Acids Research,
26819056,Recurrent Fully Convolutional Networks for Video Segmentation,2016,arXiv: Computer Vision and Pattern Recognition,
41011909,EKT: Exercise-aware Knowledge Tracing for Student Performance Prediction,2019,arXiv: Computers and Society,
228374087,A Deep Learning Approach for Automotive Radar Interference Mitigation,2019,arXiv: Signal Processing,
344744652,Learning Simpler Language Models with the Differential State Framework,2017,arXiv: Computation and Language,
162151401,Exploiting Invertible Decoders for Unsupervised Sentence Representation Learning,2018,arXiv: Neural and Evolutionary Computing,
431938336,FiLM: Visual Reasoning with a General Conditioning Layer,2017,arXiv: Computer Vision and Pattern Recognition,
495884118,Video Summarization via Actionness Ranking.,2019,arXiv: Computer Vision and Pattern Recognition,
313748438,Topical Behavior Prediction from Massive Logs,2017,arXiv: Learning,
146230766,Convolutional Poisson Gamma Belief Network,2019,arXiv: Machine Learning,
212606804,HP-GAN: Probabilistic 3D human motion prediction via GAN,2017,arXiv: Computer Vision and Pattern Recognition,
29156949,Neural Responding Machine for Short-Text Conversation,2015,arXiv: Computation and Language,
50661775,GaAN: Gated Attention Networks for Learning on Large and Spatiotemporal Graphs,2018,arXiv: Learning,
205252453,SNU_IDS at SemEval-2018 Task 12: Sentence Encoder with Contextualized Vectors for Argument Reasoning Comprehension,2018,arXiv: Computation and Language,
324894343,Improving Neural Language Models with a Continuous Cache,2016,arXiv: Computation and Language,
110075013,"Frowning Frodo, Wincing Leia, and a Seriously Great Friendship: Learning to Classify Emotional Relationships of Fictional Characters.",2019,arXiv: Computation and Language,
43456273,Extracting Automata from Recurrent Neural Networks Using Queries and Counterexamples,2017,arXiv: Learning,
134909738,Variational Sequential Labelers for Semi-Supervised Learning.,2019,arXiv: Computation and Language,
80397038,Latent Attention For If-Then Program Synthesis,2016,arXiv: Computation and Language,
155112214,Improve Diverse Text Generation by Self Labeling Conditional Variational Auto Encoder,2019,arXiv: Machine Learning,
98093959,Emotional Chatting Machine: Emotional Conversation Generation with Internal and External Memory,2017,arXiv: Computation and Language,
122362308,Learning Deep Structured Multi-Scale Features using Attention-Gated CRFs for Contour Prediction,2018,arXiv: Computer Vision and Pattern Recognition,
207269393,CanvasGAN: A simple baseline for text to image generation by incrementally patching a canvas,2018,arXiv: Computer Vision and Pattern Recognition,
180214425,Event Detection with Neural Networks: A Rigorous Empirical Evaluation,2018,arXiv: Computation and Language,
481684850,A Primer on Deep Learning Architectures and Applications in Speech Processing,2019,Circuits Systems and Signal Processing,
154476508,Are Emojis Predictable,2017,arXiv: Computation and Language,
283823798,Global-to-local Memory Pointer Networks for Task-Oriented Dialogue.,2019,arXiv: Computation and Language,
225272454,Learning text representation using recurrent convolutional neural network with highway layers,2016,arXiv: Computation and Language,
245449301,LightRNN: Memory and Computation-Efficient Recurrent Neural Networks,2016,arXiv: Computation and Language,
24274620,Hybrid Code Networks: practical and efficient end-to-end dialog control with supervised and reinforcement learning,2017,arXiv: Artificial Intelligence,
457427170,MoCoGAN: Decomposing Motion and Content for Video Generation,2017,arXiv: Computer Vision and Pattern Recognition,
191021453,A Language-independent and Compositional Model for Personality Trait Recognition from Short Texts,2016,arXiv: Computation and Language,
231969194,Spatial Memory for Context Reasoning in Object Detection,2017,arXiv: Computer Vision and Pattern Recognition,
232324023,CRNN: A Joint Neural Network for Redundancy Detection,2017,arXiv: Computation and Language,
418552153,On Extended Long Short-term Memory and Dependent Bidirectional Recurrent Neural Network,2018,arXiv: Learning,
328717249,The Statistical Recurrent Unit,2017,arXiv: Learning,
342937459,Video Fill In the Blank using LR/RL LSTMs with Spatial-Temporal Attentions,2017,arXiv: Computer Vision and Pattern Recognition,
405014008,Predicting Annotation Difficulty to Improve Task Routing and Model Performance for Biomedical Information Extraction.,2019,arXiv: Computation and Language,
97490014,STGAN: A Unified Selective Transfer Network for Arbitrary Image Attribute Editing.,2019,arXiv: Computer Vision and Pattern Recognition,
380753610,Character-based Joint Segmentation and POS Tagging for Chinese using Bidirectional RNN-CRF,2017,arXiv: Computation and Language,
463548829,SATR-DL: Improving Surgical Skill Assessment and Task Recognition in Robot-assisted Surgery with Deep Neural Networks.,2018,arXiv: Computer Vision and Pattern Recognition,
322233544,DeepBach: a Steerable Model for Bach Chorales Generation,2016,arXiv: Artificial Intelligence,
342120303,Weakly Supervised Action Learning with RNN based Fine-to-coarse Modeling,2017,arXiv: Computer Vision and Pattern Recognition,
479219365,SummaRuNNer: A Recurrent Neural Network based Sequence Model for Extractive Summarization of Documents,2016,arXiv: Computation and Language,
84281851,Abstractive Text Summarization Using Sequence-to-Sequence RNNs and Beyond,2016,arXiv: Computation and Language,
481571063,Effective Quantization Approaches for Recurrent Neural Networks,2018,arXiv: Computer Vision and Pattern Recognition,
52088220,Speech Recognition With No Speech Or With Noisy Speech Beyond English.,2019,arXiv: Audio and Speech Processing,
15225752,Content-Based Table Retrieval for Web Queries,2017,arXiv: Computation and Language,
111306035,Learning Execution through Neural Code Fusion.,2019,arXiv: Learning,
87619710,Unsupervised Discrete Sentence Representation Learning for Interpretable Neural Dialog Generation,2018,arXiv: Computation and Language,
281185392,Cultural Heritage and the Intelligent Internet of Things,2019,Journal on Computing and Cultural Heritage,
368107469,Lyrics-Based Music Genre Classification Using a Hierarchical Attention Network,2017,arXiv: Information Retrieval,
435803227,Temporal Overdrive Recurrent Neural Network,2017,arXiv: Neural and Evolutionary Computing,
481654582,Audio Word2Vec: Unsupervised Learning of Audio Segment Representations using Sequence-to-sequence Autoencoder,2016,arXiv: Sound,
352755564,Predicting Hurricane Trajectories using a Recurrent Neural Network,2018,arXiv: Learning,
391076971,Audio Scene Classification with Deep Recurrent Neural Networks,2017,arXiv: Sound,
253070640,Agree to Disagree: Improving Disagreement Detection with Dual GRUs,2017,arXiv: Computation and Language,
7719369,Delving Deeper into Convolutional Networks for Learning Video Representations,2015,arXiv: Computer Vision and Pattern Recognition,
397718992,Top-K Off-Policy Correction for a REINFORCE Recommender System.,2018,arXiv: Learning,
405471274,GradAscent at EmoInt-2017: Character- and Word-Level Recurrent Neural Network Models for Tweet Emotion Intensity Detection,2018,arXiv: Computation and Language,
496111780,Doctor AI: Predicting Clinical Events via Recurrent Neural Networks,2015,arXiv: Learning,
485306473,Finding beans in burgers: Deep semantic-visual embedding with localization.,2018,arXiv: Computer Vision and Pattern Recognition,
134700403,Toward Extractive Summarization of Online Forum Discussions via Hierarchical Attention Networks,2018,arXiv: Computation and Language,
827503,Sequential Keystroke Behavioral Biometrics for Mobile User Identification via Multi-view Deep Learning,2017,arXiv: Cryptography and Security,
387291768,Deep Reinforcement Learning-based Image Captioning with Embedding Reward,2017,arXiv: Computer Vision and Pattern Recognition,
330939600,End-to-End Radio Traffic Sequence Recognition with Deep Recurrent Neural Networks,2016,arXiv: Learning,
17635294,Dilated Recurrent Neural Networks,2017,arXiv: Artificial Intelligence,
29621577,Incorporating Discriminator in Sentence Generation: a Gibbs Sampling Method.,2018,arXiv: Computation and Language,
198156480,OpenNMT: Neural Machine Translation Toolkit,2018,arXiv: Computation and Language,
306991901,Learning Longer-term Dependencies via Grouped Distributor Unit,2019,arXiv: Neural and Evolutionary Computing,
431314034,Predicting Clinical Events by Combining Static and Dynamic Information Using Recurrent Neural Networks,2016,arXiv: Learning,
291941980,"Deep learning in bioinformatics: introduction, application, and perspective in big data era",2019,bioRxiv,
63097918,Syntax-Infused Variational Autoencoder for Text Generation,2019,arXiv: Machine Learning,
216015939,Content Selection in Deep Learning Models of Summarization,2018,arXiv: Computation and Language,
281084252,Speaker Recognition from Raw Waveform with SincNet,2018,arXiv: Audio and Speech Processing,
114251240,OpenNMT: Open-source Toolkit for Neural Machine Translation,2017,arXiv: Computation and Language,
447478914,Beyond Homology Transfer: Deep Learning for Automated Annotation of Proteins,2019,Journal of Grid Computing,
88213088,Building Context-aware Clause Representations for Situation Entity Type Classification.,2018,arXiv: Computation and Language,
59646075,Image Question Answering using Convolutional Neural Network with Dynamic Parameter Prediction,2015,arXiv: Computer Vision and Pattern Recognition,
398915513,An Attention Mechanism for Answer Selection Using a Combined Global and Local View,2017,arXiv: Computation and Language,
199711710,Neural Algebra of Classifiers,2018,arXiv: Computer Vision and Pattern Recognition,
362659904,SR-LSTM: State Refinement for LSTM towards Pedestrian Trajectory Prediction,2019,arXiv: Computer Vision and Pattern Recognition,
455249923,Sequential Neural Models with Stochastic Layers,2016,arXiv: Machine Learning,
232137673,Deep Voice: Real-time Neural Text-to-Speech,2017,arXiv: Computation and Language,
464279329,Neural Machine Translation with Word Predictions,2017,arXiv: Computation and Language,
83536866,Improved Lossy Image Compression with Priming and Spatially Adaptive Bit Rates for Recurrent Networks,2017,arXiv: Computer Vision and Pattern Recognition,
338912676,Learning Deep Sketch Abstraction,2018,arXiv: Computer Vision and Pattern Recognition,
178596473,Text Understanding with the Attention Sum Reader Network,2016,arXiv: Computation and Language,
189295838,Future Word Contexts in Neural Network Language Models,2017,arXiv: Computation and Language,
218522314,Chat Detection in an Intelligent Assistant: Combining Task-oriented and Non-task-oriented Spoken Dialogue Systems.,2017,arXiv: Computation and Language,
163885785,Sequence-Aware Recommender Systems,2018,arXiv: Information Retrieval,
206329807,Breaking the Activation Function Bottleneck through Adaptive Parameterization,2018,arXiv: Learning,
385695465,DeepCpG: accurate prediction of single-cell DNA methylation states using deep learning,2017,Genome Biology,
246994357,Adversarial Multi-task Learning for Text Classification,2017,arXiv: Computation and Language,
195715325,Efficient softmax approximation for GPUs,2016,arXiv: Computation and Language,
353119211,Named Entity Recognition with stack residual LSTM and trainable bias decoding,2017,arXiv: Computation and Language,
287520063,"Deep-speare: A Joint Neural Model of Poetic Language, Meter and Rhyme",2018,arXiv: Computation and Language,
132970872,Junction Tree Variational Autoencoder for Molecular Graph Generation,2018,arXiv: Learning,
281437199,Speech Recognition with no speech or with noisy speech.,2019,arXiv: Learning,
352184528,RNN Fisher Vectors for Action Recognition and Image Annotation,2015,arXiv: Computer Vision and Pattern Recognition,
313386297,GCDT: A Global Context Enhanced Deep Transition Architecture for Sequence Labeling,2019,arXiv: Computation and Language,
112995324,Incorporating Chinese Radicals Into Neural Machine Translation: Deeper Than Character Level.,2019,arXiv: Computation and Language,
29115829,Learning language through pictures,2015,arXiv: Computation and Language,
4097485,Gate-Variants of Gated Recurrent Unit (GRU) Neural Networks,2017,arXiv: Neural and Evolutionary Computing,
256763487,Memory Visualization for Gated Recurrent Neural Networks in Speech Recognition,2016,arXiv: Learning,
480946779,Improving Description-based Person Re-identification by Multi-granularity Image-text Alignments,2019,arXiv: Computer Vision and Pattern Recognition,
62415408,Beat by Beat: Classifying Cardiac Arrhythmias with Recurrent Neural Networks,2017,arXiv: Learning,
72400050,Modeling Coverage for Neural Machine Translation,2016,arXiv: Computation and Language,
404798976,From phonemes to images: levels of representation in a recurrent neural model of visually-grounded language learning,2016,arXiv: Computation and Language,
238279830,Investigating gated recurrent neural networks for speech synthesis,2016,arXiv: Computation and Language,
329925320,Hierarchical Temporal Convolutional Networks for Dynamic Recommender Systems,2019,arXiv: Social and Information Networks,
114978737,Approximating Real-Time Recurrent Learning with Random Kronecker Factors.,2018,arXiv: Learning,
298588217,Truly unsupervised acoustic word embeddings using weak top-down constraints in encoder-decoder models,2018,arXiv: Computation and Language,
357008326,Improved Recurrent Neural Networks for Session-based Recommendations,2016,arXiv: Learning,
430368316,Where to put the Image in an Image Caption Generator,2017,arXiv: Neural and Evolutionary Computing,
113400349,SampleRNN: An Unconditional End-to-End Neural Audio Generation Model,2016,arXiv: Sound,
436716264,Training Deep Neural Networks with Different Datasets In-the-wild: The Emotion Recognition Paradigm,2018,arXiv: Learning,
239184151,Self-Attention Aligner: A Latency-Control End-to-End Model for ASR Using Self-Attention Network and Chunk-Hopping,2019,arXiv: Computation and Language,
354701530,State-Regularized Recurrent Neural Networks.,2019,arXiv: Learning,
136713910,Rethinking Skip-thought: A Neighborhood based Approach,2017,arXiv: Computation and Language,
191808380,Efficient Robotic Grasp Learning by Demonstration,2020,,
204082000,Forecasting Severity of Motorcycle Crashes Using Transfer Learning,2020,,
127232965,Multiplicative Models for Recurrent Language Modeling,2019,arXiv: Learning,
358940453,Coarse-to-fine: A RNN-based hierarchical attention model for vehicle re-identification.,2018,arXiv: Computer Vision and Pattern Recognition,
351505465,Combining Similarity Features and Deep Representation Learning for Stance Detection in the Context of Checking Fake News.,2018,arXiv: Learning,
420429368,Generative Models for Automatic Chemical Design,2019,arXiv: Learning,
121003416,Rare Disease Detection by Sequence Modeling with Generative Adversarial Networks,2019,arXiv: Learning,
269119106,Continuously Constructive Deep Neural Networks.,2018,arXiv: Learning,
499156944,Condition monitoring of wind turbines based on spatio-temporal fusion of SCADA data by convolutional neural networks and gated recurrent units,2019,Renewable Energy,
16195688,Multiple Generative Models Ensemble for Knowledge-Driven Proactive Human-Computer Dialogue Agent.,2019,arXiv: Computation and Language,
79085000,Sequential Matching Network: A New Architecture for Multi-turn Response Selection in Retrieval-based Chatbots,2016,arXiv: Computation and Language,
384585072,A Practical Singing Voice Detection System Based on GRU-RNN,2019,,
407442432,Emotion Detection from Text Using Skip-thought Vectors,2018,,
362424891,Inter and Intra Document Attention for Depression Risk Assessment.,2019,arXiv: Computation and Language,
365934710,A Predictive Model for Music Based on Learned Interval Representations,2018,arXiv: Sound,
201916423,Investigating Recurrent Neural Network Memory Structures using Neuro-Evolution,2019,arXiv: Neural and Evolutionary Computing,
373634526,"Mirror, Mirror on the Wall, Who Is Leaving of Them All: Predictions for Employee Turnover with Gated Recurrent Neural Networks",2019,,
432322223,Nuclear Power Plant Accident Diagnosis Algorithm Including Novelty Detection Function Using LSTM,2020,,
23482559,A Bi-directional Transformer for Musical Chord Recognition.,2019,arXiv: Sound,
115732462,Advanced Customer Activity Prediction based on Deep Hierarchic Encoder-Decoders,2019,arXiv: Information Retrieval,
388073459,Neural Image Captioning,2019,arXiv: Computation and Language,
15104474,Multi-granularity bidirectional attention stream machine comprehension method for emotion cause extraction,2019,Neural Computing and Applications,
393933809,A novel process monitoring approach based on variational recurrent autoencoder,2019,Computers & Chemical Engineering,
333851760,Attention and Localization based on a Deep Convolutional Recurrent Model for Weakly Supervised Audio Tagging,2017,arXiv: Sound,
35666654,Latent Multi-Criteria Ratings for Recommendations.,2019,arXiv: Learning,
149918032,NELEC at SemEval-2019 Task 3: Think Twice Before Going Deep,2019,arXiv: Computation and Language,
166809699,Compositional Structure Learning for Sequential Video Data,2019,arXiv: Learning,
58214030,Deep Conversational Recommender in Travel,2019,arXiv: Computation and Language,
67015740,Deep Reinforcement Learning For Modeling Chit-Chat Dialog With Discrete Attributes,2019,arXiv: Learning,
403228628,Generating Text through Adversarial Training using Skip-Thought Vectors,2018,arXiv: Computation and Language,
290352860,Recurrent Convolutional Fusion for RGB-D Object Recognition,2018,arXiv: Computer Vision and Pattern Recognition,
138138837,Reinforcement Learning Applied to Adaptive Classification Testing,2019,,
268013858,An Optimized Recurrent Unit for Ultra-Low-Power Keyword Spotting,2019,,
415232399,Unified Visual-Semantic Embeddings: Bridging Vision and Language with Structured Meaning Representations,2019,arXiv: Computer Vision and Pattern Recognition,
259805855,Learning Causal State Representations of Partially Observable Environments.,2019,arXiv: Learning,
31836515,Comprehensive Evaluation of Deep Learning Architectures for Prediction of DNA/RNA Sequence Binding Specificities,2019,arXiv: Learning,
150824332,R-Transformer: Recurrent Neural Network Enhanced Transformer.,2019,arXiv: Learning,
370739547,A multi-approach to Community Question Answering,2019,Expert Systems With Applications,
265270709,Discriminative Multimodal Embedding for Event Classification,2019,Neurocomputing,
263082434,Learning compact graph representations via an encoder-decoder network,2019,,
156406663,Multi-year Long-term Load Forecast for Area Distribution Feeders based on Selective Sequence Learning.,2019,,
447792512,Modeling and Control of a Reconfigurable Photonic Circuit using Deep Learning,2019,arXiv: Quantum Physics,
334488593,Research on Neural Machine Translation Model,2019,,
248848651,Two-stream Spatiotemporal Feature for Video QA Task,2019,arXiv: Computer Vision and Pattern Recognition,
420612086,DeepNC: Deep Generative Network Completion.,2019,arXiv: Social and Information Networks,
378578764,Click-Through Rate Prediction with the User Memory Network,2019,arXiv: Information Retrieval,
408892991,SAGNet: structure-aware generative network for 3D-shape modeling,2019,ACM Transactions on Graphics,
439358769,Appellate Court Modifications Extraction for Portuguese,2019,Artificial Intelligence and Law,
105792508,Conversational Help for Task Completion and Feature Discovery in Personal Assistants.,2019,arXiv: Human-Computer Interaction,
420425851,Domain adaptation for retinal vessel segmentation using asymmetrical maximum classifier discrepancy.,2019,,
173117493,Domain-Specific Priors and Meta Learning for Low-shot First-Person Action Recognition.,2019,arXiv: Computer Vision and Pattern Recognition,
225902599,Deep Embedding Kernel,2019,Neurocomputing,
197118841,Recurrent Neural Networks for Multimodal Time Series Big Data Analytics,2019,,
327445829,A primer on neural network models for natural language processing,2016,Journal of Artificial Intelligence Research,
312332927,Drawing and Recognizing Chinese Characters with Recurrent Neural Network,2018,IEEE Transactions on Pattern Analysis and Machine Intelligence,
404769831,Combining Similarity Features and Deep Representation Learning for Stance Detection in the Context of Checking Fake News,2019,Journal of Data and Information Quality,
381861376,Dropping Activation Outputs With Localized First-Layer Deep Network for Enhancing User Privacy and Data Security,2018,IEEE Transactions on Information Forensics and Security,
394534451,Temporal Attention-Augmented Bilinear Network for Financial Time-Series Data Analysis,2019,IEEE Transactions on Neural Networks,
221768900,"Learning to Select, Track, and Generate for Data-to-Text",2019,arXiv: Computation and Language,
308093983,"Trends in Integration of Vision and Language Research: A Survey of Tasks, Datasets, and Methods.",2019,arXiv: Computer Vision and Pattern Recognition,
421468242,Future word contexts in neural network language models,2017,,
399739132,Deep Temporal Analysis for Non-Acted Body Affect Recognition.,2019,arXiv: Computer Vision and Pattern Recognition,
414114347,A recurrent convolutional neural network approach for sensorless force estimation in robotic surgery,2019,Biomedical Signal Processing and Control,
224363684,Graph Reasoning Networks for Visual Question Answering.,2019,arXiv: Computer Vision and Pattern Recognition,
283204409,Comparing the effectiveness of deep feedforward neural networks and shallow architectures for predicting stock price indices,2020,Expert Systems With Applications,
311218000,Hate Speech Detection: A Solved Problem? The Challenging Case of Long Tail on Twitter,2018,Social Work,
