id,title,year,journal_name,conf_name
366888586,RESTFul: Resolution-Aware Forecasting of Behavioral Time Series Data,2018,,Conference on Information and Knowledge Management
219159644,"Towards Conversational Search and Recommendation: System Ask, User Respond",2018,,Conference on Information and Knowledge Management
130687943,A Hybrid Retrieval-Generation Neural Conversation Model,2019,,Conference on Information and Knowledge Management
155217389,Multi-Turn Response Selection in Retrieval-Based Chatbots with Iterated Attentive Convolution Matching Network,2019,,Conference on Information and Knowledge Management
442297630,Rethinking the Item Order in Session-based Recommendation with Graph Neural Networks,2019,,Conference on Information and Knowledge Management
88150102,Matrix Factorization for Spatio-Temporal Neural Networks with Applications to Urban Flow Prediction,2019,,Conference on Information and Knowledge Management
389715398,HiCAN: Hierarchical Convolutional Attention Network for Sequence Modeling,2019,,Conference on Information and Knowledge Management
152307499,Deep Dynamic Fusion Network for Traffic Accident Forecasting,2019,,Conference on Information and Knowledge Management
47761599,Sentiment Commonsense Induced Sequential Neural Networks for Sentiment Classification,2019,,Conference on Information and Knowledge Management
40961087,A Dynamic Product-aware Learning Model for E-commerce Query Intent Understanding,2019,,Conference on Information and Knowledge Management
112700201,A curriculum learning method for improved noise robustness in automatic speech recognition,2017,,European Signal Processing Conference
99611139,Investigating Deep Neural Network Adaptation for Generating Exclamatory and Interrogative Speech in Mandarin,2018,,Signal Processing Systems
410782098,Towards Automated Emotional Conversation Generation with Implicit and Explicit Affective Strategy,2019,,Signal Processing Systems
304399991,RNN Fisher Vectors for Action Recognition and Image Annotation,2016,,European Conference on Computer Vision
253704109,Visual Text Correction,2018,,European Conference on Computer Vision
31322272,Adding Attentiveness to the Neurons in Recurrent Neural Networks,2018,,European Conference on Computer Vision
239840038,Graph Distillation for Action Detection with Privileged Modalities,2018,,European Conference on Computer Vision
57052126,Recurrent Fusion Network for Image Captioning,2018,,European Conference on Computer Vision
142519290,Visual Reasoning with Multi-hop Feature Modulation,2018,,European Conference on Computer Vision
471219288,Diverse and Coherent Paragraph Generation from Images,2018,,European Conference on Computer Vision
47886455,Teaching Machines to Understand Baseball Games: Large-Scale Baseball Video Database for Multiple Video Understanding Tasks,2018,,European Conference on Computer Vision
383021988,Pivot Correlational Neural Network for Multimodal Video Categorization,2018,,European Conference on Computer Vision
384808370,Cross-Modal and Hierarchical Modeling of Video and Text,2018,,European Conference on Computer Vision
74526394,Group LSTM: Group Trajectory Prediction in Crowded Scenarios,2018,,European Conference on Computer Vision
72254729,Residual Stacked RNNs for Action Recognition,2018,,European Conference on Computer Vision
371708841,Temporal Attention Mechanism with Conditional Inference for Large-Scale Multi-label Video Classification.,2018,,European Conference on Computer Vision
198564253,Visual Text Correction,2018,,European Conference on Computer Vision
14135020,Off-Topic Essay Detection Using C-BGRU Siamese,2020,,IEEE International conference semantic computing
327075572,Parallel Intent and Slot Prediction using MLB Fusion,2020,,IEEE International conference semantic computing
48083976,Text Understanding with the Attention Sum Reader Network,2016,,Meeting of the Association for Computational Linguistics
195311308,Pointing the Unknown Words,2016,,Meeting of the Association for Computational Linguistics
117426332,Using Sentence-Level LSTM Language Models for Script Inference,2016,,Meeting of the Association for Computational Linguistics
415131360,Tweet2Vec: Character-Based Distributed Representations for Social Media,2016,,Meeting of the Association for Computational Linguistics
192881674,Modeling Coverage for Neural Machine Translation,2016,,Meeting of the Association for Computational Linguistics
405983477,Neural Word Segmentation Learning for Chinese,2016,,Meeting of the Association for Computational Linguistics
393593884,Recurrent neural network models for disease name recognition using domain invariant features,2016,,Meeting of the Association for Computational Linguistics
379518818,Towards Abstraction from Extraction: Multiple Timescale Gated Recurrent Unit for Summarization,2016,,Meeting of the Association for Computational Linguistics
353929709,WMT 2016 Multimodal Translation System Description based on Bidirectional Recurrent Neural Networks with Double-Embeddings,2016,,Meeting of the Association for Computational Linguistics
55693019,A Neural Network based Approach to Automatic Post-Editing,2016,,Meeting of the Association for Computational Linguistics
271342525,Scalable Bayesian Learning of Recurrent Neural Networks for Language Modeling,2017,,Meeting of the Association for Computational Linguistics
36173052,OpenNMT: Open-Source Toolkit for Neural Machine Translation,2017,,Meeting of the Association for Computational Linguistics
18539166,Semi-Supervised QA with Generative Domain-Adaptive Nets,2017,,Meeting of the Association for Computational Linguistics
401798532,Hybrid Code Networks: practical and efficient end-to-end dialog control with supervised and reinforcement learning,2017,,Meeting of the Association for Computational Linguistics
236618942,Learning Discourse-level Diversity for Neural Dialog Models using Conditional Variational Autoencoders,2017,,Meeting of the Association for Computational Linguistics
354803511,Learning Character-level Compositionality with Visual Features,2017,,Meeting of the Association for Computational Linguistics
3331080,Adversarial Multi-task Learning for Text Classification,2017,,Meeting of the Association for Computational Linguistics
290577192,Topically Driven Neural Language Model.,2017,,Meeting of the Association for Computational Linguistics
91046352,Bandit Structured Prediction for Neural Sequence-to-Sequence Learning,2017,,Meeting of the Association for Computational Linguistics
163986412,Chat Detection in an Intelligent Assistant: Combining Task-oriented and Non-task-oriented Spoken Dialogue Systems,2017,,Meeting of the Association for Computational Linguistics
366873779,Rethinking Skip-thought: A Neighborhood based Approach.,2017,,Meeting of the Association for Computational Linguistics
337305348,Generating Natural Answers by Incorporating Copying and Retrieving Mechanisms in Sequence-to-Sequence Learning,2017,,Meeting of the Association for Computational Linguistics
108919956,Representing Compositionality based on Multiple Timescales Gated Recurrent Neural Networks with Adaptive Temporal Hierarchy for Character-Level Language Models.,2017,,Meeting of the Association for Computational Linguistics
270397913,Incorporating Dialectal Variability for Socially Equitable Language Identification.,2017,,Meeting of the Association for Computational Linguistics
92121060,A Tale of Two DRAGGNs: A Hybrid Approach for Interpreting Action-Oriented and Goal-Oriented Instructions,2017,,Meeting of the Association for Computational Linguistics
170019280,A Constituent-Centric Neural Architecture for Reading Comprehension.,2017,,Meeting of the Association for Computational Linguistics
41245612,Detecting Untranslated Content for Neural Machine Translation.,2017,,Meeting of the Association for Computational Linguistics
498913719,Improving a Neural Semantic Parser by Counterfactual Learning from Human Bandit Feedback,2018,,Meeting of the Association for Computational Linguistics
312015670,Token-level and sequence-level loss smoothing for RNN language models,2018,,Meeting of the Association for Computational Linguistics
253728922,On the Practical Computational Power of Finite Precision RNNs for Language Recognition,2018,,Meeting of the Association for Computational Linguistics
17238119,Aspect Based Sentiment Analysis with Gated Convolutional Networks,2018,,Meeting of the Association for Computational Linguistics
27292267,Working Memory Networks: Augmenting Memory Networks with a Relational Reasoning Module,2018,,Meeting of the Association for Computational Linguistics
61730034,Mem2Seq: Effectively Incorporating Knowledge Bases into End-to-End Task-Oriented Dialog Systems,2018,,Meeting of the Association for Computational Linguistics
435408585,"Deep-speare: A joint neural model of poetic language, meter and rhyme",2018,,Meeting of the Association for Computational Linguistics
33566979,Unsupervised Discrete Sentence Representation Learning for Interpretable Neural Dialog Generation,2018,,Meeting of the Association for Computational Linguistics
260516053,Accelerating Neural Transformer via an Average Attention Network,2018,,Meeting of the Association for Computational Linguistics
361695738,Sequential Matching Network: A New Architecture for Multi-turn Response Selection in Retrieval-Based Chatbots,2017,,Meeting of the Association for Computational Linguistics
387045749,Memory Consolidation for Contextual Spoken Language Understanding with Dialogue Logistic Inference,2019,,Meeting of the Association for Computational Linguistics
148978171,A Tale of Two DRAGGNs: A Hybrid Approach for Interpreting Action-Oriented and Goal-Oriented Instructions,2017,,Meeting of the Association for Computational Linguistics
405367851,Pointing the Unknown Words,2016,,Meeting of the Association for Computational Linguistics
49863185,Modeling Coverage for Neural Machine Translation,2016,,Meeting of the Association for Computational Linguistics
211722043,Recurrent neural network models for disease name recognition using domain invariant features,2016,,Meeting of the Association for Computational Linguistics
396977841,Using Sentence-Level LSTM Language Models for Script Inference,2016,,Meeting of the Association for Computational Linguistics
302056694,Towards Abstraction from Extraction: Multiple Timescale Gated Recurrent Unit for Summarization,2016,,Meeting of the Association for Computational Linguistics
217705013,Rethinking Skip-thought: A Neighborhood based Approach.,2017,,Meeting of the Association for Computational Linguistics
234949337,Generating Fake but Realistic Headlines Using Deep Neural Networks,2017,,Database and Expert Systems Applications
338539464,A Two-Level Attentive Pooling Based Hybrid Network for Question Answer Matching Task,2018,,Database and Expert Systems Applications
54058563,Collision-Free LSTM for Human Trajectory Prediction,2018,,Conference on Multimedia Modeling
62465018,Large Scale Audio-Visual Video Analytics Platform for Forensic Investigations of Terroristic Attacks,2019,,Conference on Multimedia Modeling
28386412,Comparative Performance Analysis of Beam Sweeping Using a Deep Neural Net and Random Starting Point in mmWave 5G New Radio,2018,,Ubiquitous Computing
317044410,Abstractive Text Summarization using Sequence-to-sequence RNNs and Beyond,2016,,Conference on Computational Natural Language Learning
398065849,Graph-based Neural Multi-Document Summarization,2017,,Conference on Computational Natural Language Learning
322814692,Learning Contextual Embeddings for Structural Semantic Similarity using Categorical Information.,2017,,Conference on Computational Natural Language Learning
261379938,Predefined Sparseness in Recurrent Sequence Models.,2018,,Conference on Computational Natural Language Learning
363306352,Abstractive Text Summarization using Sequence-to-sequence RNNs and Beyond,2016,,Conference on Computational Natural Language Learning
14139753,Graph-based Neural Multi-Document Summarization,2017,,Conference on Computational Natural Language Learning
436458114,Stories for Images-in-Sequence by Using Visual and Narrative Components,2018,,International Conference on Telecommunications
300623285,LSTM with working memory,2017,,International Joint Conference on Neural Network
229526329,Analysis of sequence to sequence neural networks on grapheme to phoneme conversion task.,2016,,International Joint Conference on Neural Network
433701539,Tweet modeling with LSTM recurrent neural networks for hashtag recommendation,2016,,International Joint Conference on Neural Network
245956660,Sentiment classification using Comprehensive Attention Recurrent models,2016,,International Joint Conference on Neural Network
301026883,Gated Recurrent Neural Tensor Network,2016,,International Joint Conference on Neural Network
334460629,ReRAM Crossbar based Recurrent Neural Network for human activity detection,2016,,International Joint Conference on Neural Network
305574918,Temporal overdrive recurrent neural network,2017,,International Joint Conference on Neural Network
392103695,Convolutional gated recurrent neural network incorporating spatial features for audio tagging,2017,,International Joint Conference on Neural Network
441343718,Compressing recurrent neural network with tensor train,2017,,International Joint Conference on Neural Network
365336669,Matching video net: Memory-based embedding for video action recognition,2017,,International Joint Conference on Neural Network
448503254,Effective Quantization Approaches for Recurrent Neural Networks,2018,,International Joint Conference on Neural Network
430604002,Tensor Decomposition for Compressing Recurrent Neural Network,2018,,International Joint Conference on Neural Network
466240708,Training Deep Neural Networks with Different Datasets In-the-wild: The Emotion Recognition Paradigm,2018,,International Joint Conference on Neural Network
376657900,Effective Quantization Approaches for Recurrent Neural Networks,2018,,International Joint Conference on Neural Network
150210783,Tensor Decomposition for Compressing Recurrent Neural Network,2018,,International Joint Conference on Neural Network
151483192,Temporal overdrive recurrent neural network,2017,,International Joint Conference on Neural Network
37690105,Training Deep Neural Networks with Different Datasets In-the-wild: The Emotion Recognition Paradigm,2018,,International Joint Conference on Neural Network
43659635,Utilizing Temporal Information in Deep Convolutional Network for Efficient Soccer Ball Detection and Tracking,2019,,Robot Soccer World Cup
135853339,Multi-Step Prediction Method of Chemical Process Variables Based on KPCA and GRU Neural Networks,2019,,International Conference on Intelligent Human-Machine Systems and Cybernetics
97933028,DeepSense: A Unified Deep Learning Framework for Time-Series Mobile Sensing Data Processing,2017,,The Web Conference
305519515,Blood Pressure Prediction via Recurrent Models with Contextual Layer,2017,,The Web Conference
373765583,Neural Network-based Question Answering over Knowledge Graphs on Word and Character Level,2017,,The Web Conference
6083247,HiText: Text Reading with Dynamic Salience Marking,2017,,The Web Conference
335957735,Sentiment Strength Prediction Using Auxiliary Features,2017,,The Web Conference
93838835,Improving Word Embedding Compositionality using Lexicographic Definitions,2018,,The Web Conference
356368351,DeepMove: Predicting Human Mobility with Attentional Recurrent Networks,2018,,The Web Conference
137254678,Conversational Query Understanding Using Sequence to Sequence Modeling,2018,,The Web Conference
189551936,Learning to Generate Questions by Learning What not to Generate,2019,,The Web Conference
168881207,Hierarchical Temporal Convolutional Networks for Dynamic Recommender Systems,2019,,The Web Conference
10232748,Event Detection using Hierarchical Multi-Aspect Attention,2019,,The Web Conference
428950637,Relevance and Importance in Deep Learning for Open Source Data Processing to Enhance Context,2019,,International Conference on Information Fusion
88118749,A Neural Architecture for Multi-label Text Classification,2018,,SAI Intelligent Systems Conference
499461275,An Introductory Survey on Attention Mechanisms in NLP Problems,2019,,SAI Intelligent Systems Conference
124893944,Anticipating Next Goal for Robot Plan Prediction.,2019,,SAI Intelligent Systems Conference
104372346,Predicting Emerging and Frontier Stock Markets Using Deep Neural Networks,2019,,SAI Intelligent Systems Conference
156683434,Towards Automatic Generation of Product Reviews from Aspect-Sentiment Scores,2017,,International Conference on Natural Language Generation
112383703,Diagonal rnns in symbolic music modeling,2017,,Workshop on Applications of Signal Processing to Audio and Acoustics
144892716,Diagonal rnns in symbolic music modeling,2017,,Workshop on Applications of Signal Processing to Audio and Acoustics
130479848,Rearrange Social Overloaded Posts to Prevent Social Overload,2017,,Advances in Social Networks Analysis and Mining
176100552,Convolutional Recurrent Neural Networks for Better Image Understanding,2016,,Digital Image Computing: Techniques and Applications
67580049,A New Model for Stock Price Movements Prediction Using Deep Neural Network,2017,,International Symposium on Information and Communication Technology
410294867,AirScript - Creating Documents in Air,2017,,International Conference on Document Analysis and Recognition
250551784,A GRU-Based Encoder-Decoder Approach with Attention for Online Handwritten Mathematical Expression Recognition,2017,,International Conference on Document Analysis and Recognition
350794998,AirScript - Creating Documents in Air,2017,,International Conference on Document Analysis and Recognition
192768558,A GRU-Based Encoder-Decoder Approach with Attention for Online Handwritten Mathematical Expression Recognition,2017,,International Conference on Document Analysis and Recognition
127245094,Residual BiRNN Based Seq2Seq Model with Transition Probability Matrix for Online Handwritten Mathematical Expression Recognition,2019,,International Conference on Document Analysis and Recognition
270091721,Challenges in End-to-End Neural Scientific Table Recognition,2019,,International Conference on Document Analysis and Recognition
411357747,Table Structure Extraction with Bi-Directional Gated Recurrent Unit Networks,2019,,International Conference on Document Analysis and Recognition
325938515,Multi-modal Attention Network for Handwritten Mathematical Expression Recognition,2019,,International Conference on Document Analysis and Recognition
332327610,ALICE: A Natural Language Question Answering System Using Dynamic Attention and Memory,2018,,Soft Computing
120151561,"Performance Evaluation of Deep Neural Networks Applied to Speech Recognition: RNN, LSTM and GRU",2019,,Soft Computing
471323387,On Training Deep Neural Networks Using a Streaming Approach,2020,,Soft Computing
408034591,A GRU-Based Neural Machine Translation Followed by Proper Noun Transliteration,2019,,Soft Computing
307690,Predicting Clinical Events by Combining Static and Dynamic Information Using Recurrent Neural Networks,2016,,IEEE International Conference on Healthcare Informatics
100519665,Predictive Modeling of Therapy Decisions in Metastatic Breast Cancer with Recurrent Neural Network Encoder and Multinomial Hierarchical Regression Decoder,2017,,IEEE International Conference on Healthcare Informatics
437413198,Neural Machine Translation with Supervised Attention,2016,,International Conference on Computational Linguistics
226114026,Byte-based Language Identification with Deep Convolutional Networks,2016,,International Conference on Computational Linguistics
254591545,Semantic Tagging with Deep Residual Networks,2016,,International Conference on Computational Linguistics
319985714,Modelling Sentence Pairs with Tree-structured Attentive Encoder.,2016,,International Conference on Computational Linguistics
35378453,From phonemes to images: levels of representation in a recurrent neural model of visually-grounded language learning,2016,,International Conference on Computational Linguistics
408409711,Combination of Convolutional and Recurrent Neural Network for Sentiment Analysis of Short Texts.,2016,,International Conference on Computational Linguistics
199663241,Ranking Responses Oriented to Conversational Relevance in Chat-bots.,2016,,International Conference on Computational Linguistics
161733229,Information Aggregation via Dynamic Routing for Sequence Encoding,2018,,International Conference on Computational Linguistics
416402677,Evaluation of Unsupervised Compositional Representations,2018,,International Conference on Computational Linguistics
366568423,Arabic named entity recognition: A bidirectional GRU-CRF approach,2017,,International Conference on Computational Linguistics
35811653,Neural Machine Translation with Supervised Attention,2016,,International Conference on Computational Linguistics
240112445,Modelling Sentence Pairs with Tree-structured Attentive Encoder.,2016,,International Conference on Computational Linguistics
436033688,PM10 density forecast model using long short term memory,2017,,International Conference on Ubiquitous and Future Networks
368842506,Neural Article Pair Modeling for Wikipedia Sub-article Matching,2018,,European Conference on Principles of Data Mining and Knowledge Discovery
353081262,Understanding Hidden Memories of Recurrent Neural Networks,2017,,Visual Analytics Science and Technology
495028805,Understanding Hidden Memories of Recurrent Neural Networks,2017,,Visual Analytics Science and Technology
191158999,Speaker Diarization Using Deep Recurrent Convolutional Neural Networks for Speaker Embeddings,2017,,International Conference on Information Systems
86681862,Evaluation of Gated Recurrent Neural Networks in Music Classification Tasks,2017,,International Conference on Information Systems
350695147,CRNN: A Joint Neural Network for Redundancy Detection,2017,,IEEE International Conference on Smart Computing
98792762,DeepDefense: Identifying DDoS Attack via Deep Learning,2017,,IEEE International Conference on Smart Computing
90742467,MIND: Model Independent Neural Decoder,2019,,International Workshop on Signal Processing Advances in Wireless Communications
246306771,DEEPTURBO: Deep Turbo Decoder,2019,,International Workshop on Signal Processing Advances in Wireless Communications
179602775,Detecting Anomalous Trajectories via Recurrent Neural Networks.,2018,,Asian Conference on Computer Vision
136515836,Generative Adversarial Networks (GANs) for Retinal Fundus Image Synthesis,2018,,Asian Conference on Computer Vision
436062337,A new multimodal deep-learning model to video scene segmentation,2018,,Brazilian Symposium on Multimedia and the Web
434890150,A study on the use of sequence-to-sequence neural networks for automatic translation of brazilian portuguese to LIBRAS,2019,,Brazilian Symposium on Multimedia and the Web
207373660,A C-GRU Neural Network for Rumors Detection,2018,,International Conference on Cloud Computing
91441828,OpenNMT: Neural Machine Translation Toolkit,2018,,Conference of the Association for Machine Translation in the Americas
343772809,Plant Classification Based on Gated Recurrent Unit,2018,,Cross-Language Evaluation Forum
282562575,Prediction of Human Trajectory Following a Haptic Robotic Guide Using Recurrent Neural Networks,2019,,World Haptics Conference
291715137,Deep specification mining,2018,,International Symposium on Software Testing and Analysis
17101429,A Neural Virtual Anchor Synthesizer Based on Seq2Seq and GAN Models,2019,,International Symposium on Mixed and Augmented Reality
365629563,Predictive View Generation to Enable Mobile 360-degree and VR Experiences,2018,,ACM Special Interest Group on Data Communication
284306790,Making content caching policies 'smart' using the deepcache framework,2019,,ACM Special Interest Group on Data Communication
151882624,Deep Learning-based Short Video Recommendation and Prefetching for Mobile Commuting Users,2019,,ACM Special Interest Group on Data Communication
369292243,Deep Learning Based Video Spatio-Temporal Modeling for Emotion Recognition,2018,,International Conference on Human-Computer Interaction
264922135,Media and Cognition Course: How to Cultivate Technical Leaders in Artificial Intelligence,2018,,International Conference on Human-Computer Interaction
291946080,An Empirical Analysis of Rumor Detection on Microblogs with Recurrent Neural Networks.,2019,,International Conference on Human-Computer Interaction
255328188,A Hybrid Stacked Traffic Volume Prediction Approach for a Sparse Road Network,2019,,International Symposium on Computers and Communications
469512703,Chinese Lyrics Generation Using Long Short-Term Memory Neural Network,2017,,"International Conference Industrial, Engineering & Other Applications Applied Intelligent Systems"
129916734,RFedRNN: An End-to-End Recurrent Neural Network for Radio Frequency Path Fingerprinting,2018,,"International Conference Industrial, Engineering & Other Applications Applied Intelligent Systems"
411352206,Automatic Speech Recognition Based on Neural Networks,2016,,International Conference on Speech and Computer
322176019,Audio-Replay Attack Detection Countermeasures,2017,,International Conference on Speech and Computer
1015891,Deep Recurrent Neural Networks in Speech Synthesis Using a Continuous Vocoder,2017,,International Conference on Speech and Computer
5843702,Recurrent DNNs and Its Ensembles on the TIMIT Phone Recognition Task,2018,,International Conference on Speech and Computer
47165932,Recurrent DNNs and Its Ensembles on the TIMIT Phone Recognition Task,2018,,International Conference on Speech and Computer
